{"schema":"daee-topology-mass-accounting-v1","case_id":"neutral-empty","input_sha256":"1111111111111111111111111111111111111111111111111111111111111111","staged_handoff_sha256":"753ed5edfa9ea4ed06ab0541f3dc605764dfc0a301aa515e5fd5c33049cf7638","output_sha256":"3333333333333333333333333333333333333333333333333333333333333333","obligations":[],"evidence_inventory":[],"partition_decisions":[],"unaccounted_obligation_ids":[],"unreconstructible_obligation_ids":[],"open_obligation_ids":[],"orphan_evidence_refs":[],"duplicate_evidence_groups":[],"initial_coverage_complete":true,"lifecycle_accounting_complete":true,"collapse_positive":true,"advisory_metrics":{"output_bytes":0},"non_claims":["counts and bytes do not determine PASS","structural accounting is not semantic truth","one run is not broad model behavior"],"authoritative_empty_universe":{"source_count":0,"source_inventory_sha256":"753ed5edfa9ea4ed06ab0541f3dc605764dfc0a301aa515e5fd5c33049cf7638","basis":"The independently supplied upstream inventory is empty."}}
